{
  "schema": 1,
  "version": "1.0.2",
  "style": "style0",
  "seed": "a",
  "scenario": "explicit",
  "sourceHashes": {
    "Dev": "3bf75140e92dd8647c338c6cd06c8c180054d422fe5169d824aed6977cf0e7e8",
    "Hills": "ae71adcb4870e3b3cfe0a2ad4d7684e68411be4ed309d01a71a3b048881d12ee",
    "Settings": "64b10bb49f13c0781afa899a216bf565ed6ab97cef212a5eca1b7673e4cc01da",
    "Rand": "7e8f0ddefecacaa1268d4e58c5d92e7b248d37fba057e75f734ec5a90987d073",
    "Normals": "3ae7beb33c892dd742dad0f561fdbaee8113c3431020e5d1adb18ebd5844bdfc"
  },
  "sections": {
    "vector2": "33a9255c8b5bad0cd7c325073456102eda36ef613e14114d5caf0dfba7517fbc",
    "vector3": "79052ce1b1060fe43f96756dd2a03389f16a44a0b092c5433cec938b0d88a910",
    "curve": "294084122cd0fe5f030b7e4490a4728a929cdd527dd018f05debdc9984355ac4",
    "gradient": "6fc3a7a74bd2bfcd5012d6ffe47391761854bd2af0af02d0d240a30440a23a95",
    "midline": "a3fa76706c14cff2ef98d92faf10329e967d7b55950fbe3ef55a026556a454bf",
    "hillsMidline": "637b5cf8d9acc3ab29af4065a852ff6dc376d38e4421e03d047fc35b7d9044de"
  },
  "profile": {
    "midline": {
      "isStraight": true,
      "smoothWindow": 9,
      "maxGrad": 0.2,
      "genRadius": 100,
      "genMinRadius": 100,
      "minStartElev": 10,
      "maxStartElev": 1000,
      "curvatureHeightFactor": 50,
      "minFineSegs": 4,
      "solidLineThreshold": 0.1,
      "solidLineCrestThreshold": -0.02,
      "markingsMargin": 12,
      "startPos": {
        "x": 0,
        "y": 20,
        "z": 0
      },
      "startHeading": {
        "x": 1,
        "y": 0,
        "z": 0
      }
    },
    "heightmap": {
      "scale": 80,
      "offset": 90,
      "layerResolutions": [
        3,
        21,
        17,
        31
      ],
      "squared": true,
      "depthHeightFactor": 0.7,
      "temper": true,
      "temperBase": 50,
      "temperBelow": 400,
      "temperMin": 0,
      "spiralise": false,
      "tileScaleRandom": 0.3
    },
    "treemap": {
      "scale": 3,
      "offset": 1.7,
      "layerResolutions": [
        21,
        9,
        31
      ],
      "squared": true,
      "depthHeightFactor": 1.2,
      "temper": false,
      "tileScaleRandom": 0.3
    },
    "graphicsDetail": 2,
    "treeDensity": "Auto",
    "laneStyle": "Standard",
    "startNode": 0
  },
  "effectiveMidlineConfig": {
    "seed": 1,
    "feelDist": 10,
    "feelAng": 0.463,
    "maxTurnDelta": 0.7,
    "nodeSpacing": 10,
    "panicDist": 10,
    "distRange": 0,
    "testDist": 20,
    "minElev": 2,
    "maxGrad": 0.2,
    "isStraight": true,
    "minBridgeElev": 0,
    "maxBridgeElev": 4,
    "maxBridgeNodes": 35,
    "minBridgeNodes": 3,
    "minStartElev": 10,
    "maxStartElev": 1000,
    "genRadius": 100,
    "genMinRadius": 100,
    "genDeviation": 0,
    "curvatureHeightFactor": 50,
    "minFineSegs": 4,
    "roadSink": 0.2,
    "squared": false,
    "smoothWindow": 9,
    "smoothFactor": 1,
    "fineHorizon": 400,
    "restartMargin": 200,
    "direction": null,
    "hasSmoothing": true,
    "smoothingStrength": 1,
    "maxGradLon": 5,
    "testBridgeLateral": true,
    "overflowRevertBase": 25,
    "canEmergencyBridge": true,
    "maxTargetOverflow": 3,
    "solidLineThreshold": 0.1,
    "solidLineCrestThreshold": -0.02,
    "markingsMargin": 12,
    "startPos": {
      "x": 0,
      "y": 20,
      "z": 0
    },
    "startHeading": {
      "x": 1,
      "y": 0,
      "z": 0
    },
    "spiralise": false
  },
  "effectiveHeightConfig": {
    "seed": "a",
    "scale": 80,
    "offset": 90,
    "layerResolutions": [
      3,
      21,
      17,
      31
    ],
    "squared": true,
    "depthHeightFactor": 0.7,
    "temper": true,
    "temperBase": 50,
    "temperBelow": 400,
    "temperMin": 0,
    "spiralise": false,
    "tileScaleRandom": 0.3,
    "maxCached": 8
  },
  "inputContract": {
    "coordinates": "world XZ / Y, JS Number",
    "midlineHeightmapCache": 8,
    "worldHeightmapCache": 20,
    "note": "Original B7/Se with labeled synthetic height returns; no update() calls"
  },
  "initial": {
    "generation": 2,
    "head": {
      "i": -17,
      "p": [
        0,
        19.8,
        0
      ],
      "a": 0,
      "da": 0,
      "t": 0,
      "g": 0,
      "gf": 0,
      "gfa": 0,
      "h": 0,
      "n": [
        0,
        0,
        1
      ],
      "bridge": false,
      "blend": 0,
      "o": null,
      "fs": null
    },
    "tail": {
      "i": -17,
      "p": [
        0,
        19.8,
        0
      ],
      "a": 0,
      "da": 0,
      "t": 0,
      "g": 0,
      "gf": 0,
      "gfa": 0,
      "h": 0,
      "n": [
        0,
        0,
        1
      ],
      "bridge": false,
      "blend": 0,
      "o": null,
      "fs": null
    },
    "fineTail": {
      "i": -17,
      "p": [
        0,
        19.8,
        0
      ],
      "a": 0,
      "da": 0,
      "t": 0,
      "g": 0,
      "gf": 0,
      "gfa": 0,
      "h": 0,
      "n": [
        0,
        0,
        1
      ],
      "bridge": false,
      "blend": 0,
      "o": null,
      "fs": null
    },
    "smoothWindowHead": {
      "i": -17,
      "p": [
        0,
        19.8,
        0
      ],
      "a": 0,
      "da": 0,
      "t": 0,
      "g": 0,
      "gf": 0,
      "gfa": 0,
      "h": 0,
      "n": [
        0,
        0,
        1
      ],
      "bridge": false,
      "blend": 0,
      "o": null,
      "fs": null
    },
    "startNode": 0,
    "restartCount": 0,
    "generationCount": 0,
    "prevT": 0,
    "byWater": false,
    "waterFactor": 0,
    "targetDir": [
      0,
      0,
      0
    ],
    "prevTargetSide": 0,
    "targetOverflow": 0,
    "accumulatedOverflow": 0,
    "antiTarget": [
      0,
      0,
      0
    ],
    "antiTargetRange": 0,
    "antiTargetTriggerCount": 0,
    "bridge": {
      "active": false,
      "approach": false,
      "dismount": false,
      "spawnIndex": null,
      "quality": 0,
      "landing": [
        0,
        0,
        0
      ],
      "distance": 0,
      "height": null
    },
    "tailLayers": [
      0,
      0
    ],
    "headLayers": [
      0,
      0
    ],
    "trackers": [
      {
        "i": 0,
        "n": -17,
        "da": 0,
        "threshold": 3.3
      },
      {
        "i": 1,
        "n": -17,
        "da": 0,
        "threshold": 3.3
      },
      {
        "i": 2,
        "n": -17,
        "da": 0,
        "threshold": 3.3
      },
      {
        "i": 3,
        "n": -17,
        "da": 0,
        "threshold": 3.3
      }
    ],
    "aleaState": [
      0.8672755148727447,
      0.008185631828382611,
      0.4245572602376342,
      1372974
    ],
    "randState": [
      0.6564107977319509,
      0.8672755148727447,
      0.008185631828382611,
      1
    ],
    "layerEventCount": 2,
    "queryCount": 4
  },
  "initialQueryEvents": [
    {
      "x": 0,
      "z": 0,
      "depth": null,
      "value": 20
    },
    {
      "x": 0,
      "z": -10,
      "depth": null,
      "value": 20
    },
    {
      "x": 10,
      "z": 0,
      "depth": null,
      "value": 20
    },
    {
      "x": 0,
      "z": 10,
      "depth": null,
      "value": 20
    }
  ],
  "initialLayerEvents": [
    {
      "layers": [
        0,
        0
      ]
    },
    {
      "layers": [
        0,
        0
      ]
    }
  ],
  "restart": null,
  "smoothing": null,
  "bridgeTest": null,
  "bridgeImprove": null,
  "trace": []
}
